id;name;region;city;address;website;phone;fax;email;director;legal_form;source_url
661;Санаторий-профилакторий «Азнакаевский»;Республика Татарстан;Азнакаево;423330, Республика Татарстан, г. Азнакаево, ул. Ямашево, д. 2;;+7 (85592) 7-79-38, 7-79-74;7-79-38;Sanatazn1@yahoo.com;;Общество с ограниченной ответственностью;https://sanatoria.ru/san.php?org=661
662;Санаторий-профилакторий «Джалильский»;Республика Татарстан;;423368, Республика Татарстан, Сармановский район, пгт. Джалиль, улица Лесная, дом 6;http://dzhalilskiy.tatneft.ru/;+7 (85559) 63-084, 63-081, 63-083;(8553) 37-00-16;sanat.jalil@mail.ru;Ризатдинова Эльмира Дамировна;публичное акционерное общество;https://sanatoria.ru/san.php?org=662
663;Санаторий работников органов прокуратуры РФ «Истра»;Московская область Истринский район деревня Аносино улица Санаторная дом 7;;143581, Московская область Истринский район деревня Аносино улица Санаторная дом 7;http://www.s-istra.ru/;+7 (495) 994-71-66;;matveev@s-istra.ru;Пикурин Сергей Михайлович;Федеральное государственное учреждение;https://sanatoria.ru/san.php?org=663
664;Санаторий «Чувашиякурорт» — водогорязелечебница;Чувашская республика;Чебоксары;428034, Чувашская республика, г. Чебоксары, ул. М. Павлова, д. 29;http://www.chuvkurort.ru/;+7 (8352) 41-10-74 (маркетинг), 41-98-98 (гостиница);41-38-96;chuvkurort1@mail.ru;;акционерное общество;https://sanatoria.ru/san.php?org=664
665;Санаторий «Солнечный»;Нижегородская область;;606131, Нижегородская область, Павловский район, п/о Тумботино, д. Венец;http://solarsan.ru/;+7 (831) 415-12-41, 903-97-15;+7 (83171) 6-83-88;solar_san@inbox.ru;Бетина Ольга Станиславовна;общество с ограниченной ответственностью;https://sanatoria.ru/san.php?org=665
666;Санаторий-профилакторий «Гренада»;Алтайский край;;658045, Россия, Алтайский край, Первомайский район, п. Казачий;http://www.grenada-san.ru/;+7 (38532) 50-401, 50-732, 50-401;;san_grenada@mail.ru;Лебедева Татьяна Николаевна;Общество с ограниченной ответственностью;https://sanatoria.ru/san.php?org=666
667;Санаторий «Серебряный бор»;Пензенская область;Пенза;440016, Пензенская область, г. Пенза, ул. Спартаковская, д. 28а;http://silvery.ru/;+7 (8412) 62-82-17, +7 (8412) 62-98-54, +7 (8412) 62-82-33 (вахта);;628217@mail.ru;Блинова Надежда Александровна;общество с ограниченной ответственностью;https://sanatoria.ru/san.php?org=667
668;Санаторий им. Артема;;Химки;141422, М/о, г. Химки, мкр. Фирсановка, санаторий им. Артема;http://www.gupmc.ru/list_10.html;+7 (499) 736-14-81 (секретарь), 736-14-86 (регистратура);736-14-81;sanatoriyartem@mail.ru;Рябушенко Сергей Игоревич;Государственное унитарное предприятие;https://sanatoria.ru/san.php?org=668
669;Байкальский горнолыжный курорт «Гора Соболиная»;Иркутская область;Байкальск;665932, Иркутская область, Слюдянский район, г. Байкальск, м-н Красный Ключ, 90, а/я 61;http://www.baikalski.com/;+7 (39542) 3-30-65;3-30-65;info@baikalski.com;Темгеневский Василий ВячеславовичИркутская область, Слюдянск;общество с ограниченной ответственностью;https://sanatoria.ru/san.php?org=669
670;Санаторий Профсоюзного Центра Евро-Азия-Дон «Донская Здравница»;;Ростов-на-Дону;344007, г. Ростов-на-Дону, ул. Левобережная, 2;http://www.don-zdrav.ru/;+7 (863) 218-57-30, 218-57-10, 2-18-57-10;;evrodon@list.ru;Калинин Михаил Антонович;Общество с ограниченной ответственностью;https://sanatoria.ru/san.php?org=670
671;Центр лечебно-профилактической медицины «Медиком»;Ивановская область;Иваново;153025, Ивановская область, г. Иваново, ул. Дзержинского, д. 13;http://www.medicom37.ru/;+7 (4932) 49-26-64, 33-57-34;33-57-34;medicomiv@yandex.ru;Кривогонов Андрей Борисович;общество с ограниченной ответственностью;https://sanatoria.ru/san.php?org=671
672;ФГБУ «Детский пульмонологический санаторий «Колчаново»;;;187439, Ленинградская обл., Волховский р-н, с. Колчаново, Центральная ул., 1;http://xn--80aaai2aghingfddbulu1h.xn--p1ai/;+7 (81363) 38-073, 38-144, 38-868;38-073;dps-kolchanovo@mail.ru;Ершков Александр Николаевич;федеральное государственное учреждение;https://sanatoria.ru/san.php?org=672
673;Санаторий «Центросоюз-Кисловодск»;Ставропольский край;Кисловодск;357700, Ставропольский край, г. Кисловодск, ул. Володарского, 12;http://centrosouz.com/;+7 (87937) 2-67-72, 2-23-99;;bron@centrosouz.com;Пляшников Виталий Олегович;общество с ограниченной ответственностью;https://sanatoria.ru/san.php?org=673
674;Санаторий «Березовый гай»;;Хмельник;22000, Украина, Винницкая обл., г. Хмельник, ул. Курортная, 12;http://www.sanatory.vn.ua/;+380 (432) 55-59-59, +380 67-130-0-130;+380 (432) 55-59-50;berezovuy@rambler.ru;Лукашик Владимир Михайлович;общество с ограниченной ответственностью;https://sanatoria.ru/san.php?org=674
675;Туберкулезный санаторий «Голубая бухта»;Краснодарский край;Геленджик;353467, Краснодарский край, город Геленджик, улица Просторная 2;http://golubayabuhta.ru/;+7 (86141) 3-61-80, +7 (86141) 2-80-74;;golubayabuhta@bk.ru;Хрестин Виктор Александрович;Федеральное государственное бюджетное учреждение;https://sanatoria.ru/san.php?org=675
676;ЛПУ «Санаторий имени Кирова»;Ставропольский край;Железноводск;357400, Ставропольский край, г. Железноводск, ул. Лермонтова 12;http://sankirova.ru/;+7 (800) 600-13-30, +7 (87932) 4-26-00, +7 (87932) 6-09-83, 6-09-82;;majorova_ai@profkurort.ru;-главный врач;лечебно-профилактическое учреждение;https://sanatoria.ru/san.php?org=676
677;Санаторий-профилакторий «АХТУБА»;;;404130, Волгоградская обл. г. Волжский, ул. Набережная, 2Д;http://www.ahtuba.volzhsky.ru/;+7 (4430) 34-14-01, 34-20-32;34-10-76;nnmartinova@yandex.ru;Полетаев Вячеслав Михайлович;общество с ограниченной ответственностью;https://sanatoria.ru/san.php?org=677
678;Санаторий «Бузулукский Бор»;Оренбургская область;;461001, Оренбургская область, Бузулукский р-он, пос. Партизанский, ул. Школьная, 14 «Б»;http://sanbb.ru/;+7 (922) 62-66-666, +7 (35342) 4-222-3;+7 (35342) 4-49-19;sanbb@list.ru;Шабаева Елена Вячеславовна;общество с ограниченной ответственностью;https://sanatoria.ru/san.php?org=678
679;Санаторий им.;Ставропольский край;Кисловодск;357700, Ставропольский край, г. Кисловодск, пр. Ленина, д. 25;http://sergos.ru/;+7 (87937) 6-57-08, 6-57-20;6-54-00;market@sergos.ru;Елизаров Николай Александрович;филиал;https://sanatoria.ru/san.php?org=679
680;Кардиологический санаторный центр «Переделкино»;Москва;;119619, Москва, р-н Ново-Переделкино, ул. 6-я Лазенки, д. 2, стр. 2;http://peredelkinokardio.ru/;+7 (495) 105-90-92, +7 (962) 901-36-00;;info@peredelkinokardio.ru;Сучков Максим Александрович;общество с ограниченной ответственностью;https://sanatoria.ru/san.php?org=680
681;Санаторий «Ревиталь Парк»;Московская область;Балашиха;143982, Московская область, г. Балашиха, Леоновское шоссе, д. 2;http://revital.ru/;+7 (495) 411-60-00, 411-79-99;521-52-21;reklama@revital.ru;;общество с ограниченной отвественностью;https://sanatoria.ru/san.php?org=681
682;Санаторий «Усть-Кут»;Иркутская область;Усть-Кут;666787, Иркутская область, г. Усть-Кут, ул. Курорт, строение 1;http://sanatoriy-ustkut.ru/;+7 (39565) 5-48-59, 5-44-80;5-48-59;kurort_ust-kut@mail.ru;Сафонова Светлана Юрьевна;закрытое акционерное общество;https://sanatoria.ru/san.php?org=682
683;Санаторий «Юрмино»;Республика Крым;Саки;96500, Россия, Республика Крым, г. Саки, ул. Морская, 11а;http://yurmino.ru/;+38 (06563) 99-217, 99-246;+38 (06563) 99-285;info@yurmino.com;Афонина Наталья Николаевна;частное предприятие;https://sanatoria.ru/san.php?org=683
684;ЛПУ «Санаторий имени Анджиевского»;Ставропольский край;Ессентуки;357600, Россия, Ставропольский край, г. Ессентуки, ул. Разумовского, 5;http://www.sanand.ru/;+7 (87934) 6-50-82, 6-50-83;6-50-83;65083@mail.ru;Шаклеин Герман Сергеевич;некоммерческая организация;https://sanatoria.ru/san.php?org=684
685;Санаторий «Русь» им. Лиходея, Руза, Подмосковье;;;143129, Россия, Московская обл., Рузский р-н, с/п Ивановское, дер. Палашкино, санаторий «Русь»;http://cvt-l.ru/;+7 (926) 520-50-50;;;Бризецкий Станислав Николаевич;учреждение;https://sanatoria.ru/san.php?org=685
686;Санаторий «Лесное озеро»;Кемеровская область;;652775, Кемеровская область, Гурьевский район, Лесное озеро, квартал 55/2;http://lesnoeozero-42.ru/;+7 (923) 48-58-777;;l.ozero2010@yandex.ru;Шкляева Наталья Александровна;общество с ограниченной ответственностью;https://sanatoria.ru/san.php?org=686
687;Оздоровительный центр «Омега-2001»;Республика Алтай;;649234, Республика Алтай, Чемальский район, село Узнезя, д. 49;;+7 (38841) 27-612, +7 (913) 210-50-41;+7 (38841) 27-612;nlobanov60@mail.ru;Вяткина Алла Васильевна;закрытое акционерное общество;https://sanatoria.ru/san.php?org=687
688;Санаторно-курортный комплекс «Термал-Стар»;Закарпатская область;;89442, Украина, Закарпатская область, Ужгородский район, с. Нижнее Солотвино, 226;http://www.termal-star.com/;+7 (985) 787-61-58, +38 (0312) 72-29-00;;termalstar.moscow@gmail.com;;общество с ограниченной ответственностью;https://sanatoria.ru/san.php?org=688
689;Санаторий «Журавушка» — структурное подразделение КУП «Минскхлебпром»;Республика Беларусь;Минск;220600, Республика Беларусь, г. Минск, ул. Витебская, д. 17;http://www.sanatorij.by/;+ 37517 203-08-93;+ 37517 203-08-93, 203-10-61;sanatori@minskhleb.by;Талайко Владимир Вячеславович;коммунальная (государственная);https://sanatoria.ru/san.php?org=689
690;Санаторий «Урал»;Оренбургская область;Оренбург;460037, Оренбургская область, г. Оренбург, 2-я Озерная ул., д. 21;;+7 (3532) 77-17-37, +7(922)625-84-07, 77-73-40;;sanatural@mail.ru;Рябуха Татьяна Георгиевна;общество с ограниченной ответственностью;https://sanatoria.ru/san.php?org=690
692;Санаторий-профилакторий «Сибирское Здоровье»;Кемеровская область;Новокузнецк;654008, Кемеровская область, г. Новокузнецк, ул. Садопарковая, 32;http://sibzdorovie.ru/;+7 (3843) 56-20-07, 56-20-08;56-20-08;info@sibzdorovie.ru;Максимова Лилия Михайловна;общество с ограниченной ответственностью;https://sanatoria.ru/san.php?org=692
693;Санаторий «Русь», Ессентуки;Ставропольский край;Ессентуки;357623, Ставропольский край, г. Ессентуки, ул. Пушкина, д. 16;http://www.ruskmv.ru/;+7 (87934) 4-37-14, +7 (800) 555-11-40;+7 (87934) 4-37-15;marketing@ruskmv.ru;Минина Ольга Николаевна;общество с ограниченной ответственностью;https://sanatoria.ru/san.php?org=693
694;Санаторий «Зеленая Роща» Сочи;Краснодарский край;Сочи;354024, Россия, Краснодарский край, г. Сочи, Курортный проспект, 120;http://rosha-sochi.ru/;+7 (862) 269-53-63, 269-53-06;261-98-79;zelro_putevka@mail.ru;Джелиев Заурбек Хасанбекович;открытое акционерное общество;https://sanatoria.ru/san.php?org=694
695;ГАУЗ «Санаторий „Домашово“ для детей с родителями»;;;241514, Брянская обл., Брянский р-н, с. Домашово, ул. Садовая, 19;http://domashovo.brkmed.ru/;+7 (4832) 303-913, 303-919;303-913;sandomashovo@yandex.ru;Курилов Анатолий Владимирович;государственное автономное учреждение здравоохранения;https://sanatoria.ru/san.php?org=695
696;Санаторий «Циолковский»;Самарская область;;446378, Самарская область, Красноярский район, Сельское поселение Светлое поле, 61 км. Автодороги Самара-Ульяновск, Литера 17;http://newsanatory.ru/;+7 (846) 200-3-200, 200-45-90, +7 (927) 017-91-71;;newsanatory@mail.ru;Буракшаева Гульнара Гумаровна;непубличное акционерное общество;https://sanatoria.ru/san.php?org=696
697;Санаторий-профилакторий «Тополь» — филиал «Приазовье» в Таганроге ООО «Уральский Двор»;Ростовская область;Таганрог;347909, Россия, Ростовская область, г. Таганрог, ул. Социалистическая, д. 170;http://priazovie-spa.ru/;+7 (8634) 32-00-15, 32-00-17;32-00-15;priazovye.spa@mail.ru;;общество с ограниченной ответственностью;https://sanatoria.ru/san.php?org=697
699;Санаторий «Бобачёвская роща»;Тверская область;Тверь;170028, Россия, Тверская область, г. Тверь, Бобачёвская роща;http://www.bobachevka.ru/;+7 (4822) 58-14-63, +7 (4822) 58-06-60;;bobachevka@mail.ru;Боронина Ирина Алексеевна;закрытое акционерное общество;https://sanatoria.ru/san.php?org=699
700;CRONA Medical&SPA hotel;Новосибирская область;Бердск;633011, Новосибирская область, г. Бердск, ул. Морская, 26;http://cronahotel.ru/;+7 (383) 287-10-10;;sankur@cronahotel.ru;Шелепенкова Юлия Евгеньевна;общество с ограниченной ответственностью;https://sanatoria.ru/san.php?org=700
701;Санаторий «Дворцы»;;;186901, Карелия, Кондопожский район, п. Марциальные воды;http://dvortcy.ru/;+7 (8142) 76-33-11, +7 (8142) 59-91-93;+7 (8142) 59-91-73;zakaz@dvortcy.ru;Борик Ирина Васильевна;общество с ограниченной ответственностью;https://sanatoria.ru/san.php?org=701
702;Санаторий-профилакторий «Чайка»;Пермский край;Чайковский;617760, Пермский край, г. Чайковский, ул. Ленина, д. 61;http://www.spchaika.ru/;+7 (34241) 2-31-75 (менеджер), 2-33-57 (директор);+7 (34241) 2-33-74;spchaika@mail.ru;Наземнова Инна Юрьевна;общество с ограниченной ответственностью;https://sanatoria.ru/san.php?org=702
703;Санаторий «Родина»;Республика Крым;;98662, Россия, Республика Крым, Ялта, Гаспра-2, Алупкинское шоссе, 15;http://www.s-ukraine.com/;+7 (0654) 27 47 13, 27 47 24;24 74 32;san-ukraine@yandex.ru;Кравченко Александр Григорьевич;Государственное Унитарное Предприятие Республики Крым;https://sanatoria.ru/san.php?org=703
704;Клиника-санаторий «Набережные Челны»;Республика Татарстан;Набережные Челны;423826, Республика Татарстан, г. Набережные Челны, пр. Чулман, 61/04;http://klinika116.ru/;+7 (8552) 56-53-18, 56-76-11;56-84-90;klinika_nab@mail.ru;- главный врач;общество с ограниченной ответственностью;https://sanatoria.ru/san.php?org=704
705;Санаторий «Родник»;Ставропольский край;Кисловодск;357700, Ставропольский край, г. Кисловодск, ул. Профинтерна, д. 50;http://rodnik-cmw.ru/;+7 (87937) 31-055, 31-006;30-340;contact@rodnik-cmw.ru;;закрытое акционерное общество;https://sanatoria.ru/san.php?org=705
706;Санаторий «Радон»;Ульяновская область;Ульяновск;432010, Ульяновская область, г. Ульяновск, ул. Оренбургская, 5а;http://radon-nt.com/;+7 (8422) 52-02-02, 26-30-04;52-02-02;radonul@mail.ru;Панов Сергей Валерьевич;общество с ограниченной ответственностью;https://sanatoria.ru/san.php?org=706
707;Центр реабилитации ФСС РФ «Ключи»;Томская область;;634526, Томская область, Томский район, поселок Ключи;http://kluchi.tom.ru/;+7 (3822) 92-20-31, 92-40-65;92-39-58;kluchi@mail.tomsknet.ru;Аксенов Анатолий Леонтьевич;федеральное бюджетное учреждение;https://sanatoria.ru/san.php?org=707
708;Санаторий «Кленовая роща»;Пензенская область;Спасск;442600, Пензенская область, г. Спасск, ул. Ленина, 106;http://www.klen-rosha.ru/;+7 (8412) 45-10-05, +7 (927) 375-06-00;+7 (927) 381-73-05;Korabl_kl@mail.ru;Названов Владимир Александрович;общество с ограниченной оттветственностью;https://sanatoria.ru/san.php?org=708
709;Клинический санаторий «Полтава-Крым»;Республика Крым;Саки;296500, Россия, Республика Крым, г. Саки, ул. Морская, д. 8;http://poltava-crimea.ru/;+7 (800) 444-07-14, +7 (36563) 333-00, +7 (978) 974-41-44;;info@poltava-crimea.ru;Ракоцило Александр Николаевич;акционерное общество;https://sanatoria.ru/san.php?org=709
710;Санаторий «Алуштинский»;Республика Крым;Алушта;298500, Россия, Республика Крым, г. Алушта, ул. Октябрьская, 16;;+7 (06560) 2-54-66, 7-62-88;2-54-73;alushtaoffice@gmail.com;Польщиков Анатолий Анатольевич;государственное предприятие;https://sanatoria.ru/san.php?org=710
711;Санаторий «Ливадия» — г. Казань;Республика Татарстан;Казань;420029, Республика Татарстан, г. Казань, ул. Сибирский тракт, санаторий «Ливадия»;http://www.livadiakazan.ru/;+7 (843) 237-60-30, 237-74-73;237-74-73;livadia_07@mail.ru;Галимуллин Фарид Аухадуллович;учреждение профсоюзов;https://sanatoria.ru/san.php?org=711
712;ФКУЗ Санаторий «Подмосковье» МВД РФ;Московская область;Звенигород;143180, Московская область, г. Звенигород, Ратехинское шоссе, владение 2;http://xn--b1adesjkcbdy8j.xn--d1a2a.xn--b1aew.xn--p1ai/;+7 (495) 597-11-23 доб 22-56, +7 (495) 597-12-41;597-12-41;podmoskovmvd@mail.ru;;федеральное казенное учреждение здравоохранения;https://sanatoria.ru/san.php?org=712
713;Пансионат «Ольшаники»;Ленинградская область;;188855, Россия, пос. Ольшаники, Выборгский район, Ленинградская область, Центральная, 50;http://olshanikihotel.ru/;+7 (812) 715-00-94, +7 (921) 634-14-21;;olshaniki@mail.ru;Аблаев Александр Николаевич;общество с ограниченной ответственностью;https://sanatoria.ru/san.php?org=713
714;Курортный отель «Беловодье»;Алтайский край;Белокуриха;659900, Алтайский край, г. Белокуриха, ул. Мясникова, д. 4а;http://belovodie.su/;+7 (38577) 32-9-51, +7 (800) 700-11-13;+7 (38577) 3-29-72;sale@belovodie.su;Махов Сергей Геннадьевич;общество с ограниченной ответственностью;https://sanatoria.ru/san.php?org=714
715;Санаторий-профилакторий «Ставрополь»;Самарская область;Тольятти;445003, Самарская область, г. Тольятти, Лесопарковое шоссе, 22;http://www.stavropol63.ru/;+7 (8482) 48-99-26, 55-19-12;37-96-80;stavr489800@yandex.ru;Писаренко Андрей Анатольевич;обособленное подразделение;https://sanatoria.ru/san.php?org=715
716;Санаторий-курорт имени;Саратовская область;;413512, Россия, Саратовская область, Ершовский район, с. Чапаевка, ул. Почтовая, д. 9;http://sanatorij-chapaev.ru/;+7 (986) 982-77-43, +7 (845) 645-69-65;;chapaeva.sar@mail.ru;Пляченко Дмитрий Анатольевич;закрытое акционерное общество;https://sanatoria.ru/san.php?org=716
717;Павловский детский санаторий «Зарница»;Алтайский край;;659000, Алтайский край, Павловский район, с. Павловск, ул. Хвойная, 2;http://zarnica.zdravalt.ru/;+7 (38581) 2-26-25, 2-02-15;2-02-15;sanatori@ab.ru;Добшик Сергей Николаевич;КГБУЗ;https://sanatoria.ru/san.php?org=717
