id;name;region;city;address;website;phone;fax;email;director;legal_form;source_url
485;Санаторий «Голубая речка»;;;143057, Московская обл., Одинцовский р-н, село Каринское;http://blueriver.ru/;+7 (495) 992-00-33, +7 (495) 992-00-34, +7 (495) 992-00-38 (пт-вс 24ч);;g.rechka@bk.ru;Князев Зунг Зунгович;федеральное бюджетное учреждение;https://sanatoria.ru/san.php?org=485
486;Пансионат «Шексна»;Краснодарский край;Сочи;354209, Краснодарский край, г. Сочи, пос. Вардане, ул. Львовская, 8/5;http://www.sheksna.ru/;+7 (862) 2-699-600, 8 (800) 200-79-69, +7 (862) 2699-602, 2699-603;+7 (862) 2-699-601;sheksna@sheksna.ru;Липухин Виктор Юрьевич;общество с ограниченной ответственностью;https://sanatoria.ru/san.php?org=486
487;Больше не работает — Санаторий-профилакторий «Атлант»;Пермский край;;617077, Пермский край, Краснокамский р-н, п. Майский, ул. Запрудная, д. 1;;;;;Нечаев Игорь Викторович;акционерное общество;https://sanatoria.ru/san.php?org=487
488;Санаторий-профилакторий «Каштак»;;Челябинск;454013, г. Челябинск, пос. Каштак, санаторий-профилакторий «Каштак»;;+7 (351) 724-62-52, 725-43-11;725-43-11;emyagrova@mechel.ru;Мягкова Елена Юрьевна;Учреждение;https://sanatoria.ru/san.php?org=488
489;Санаторий-профилакторий ФГУП «Цаги»;;;140180, Московская обл., Раменский р-н,. п. Кратово, ул. Зеленая зона, д. 2;;+7 (495) 556-45-40, 556-42-26, 8 (496) 46-2 30 23;;;"ФГУП ""Цаги""";научно-исследовательская коммерческая организация;https://sanatoria.ru/san.php?org=489
490;Санаторий-профилакторий «Станкостроитель»;Алтайский край;Барнаул;656045, Алтайский край, г. Барнаул, ул. Тихонова, дом 33, кор. «Б»;http://sps22.su/;+7 (3852) 684-625;684-942;manskova@ab.ru;Манскова Ирина Викторовна;общество с ограниченной ответственностью;https://sanatoria.ru/san.php?org=490
491;Санаторий-профилакторий «Обские плесы»;Алтайский край;;658065, Алтайский край, Первомайский район, с. Кислуха;http://obskie22.ru/;+7 (3852) 99-85-85, +7 (3852) 28-28-30, +7 (3852) 28-28-01;;obskie22@mail.ru;Прокурова Татьяна Сергеевна;общество с ограниченной ответственностью;https://sanatoria.ru/san.php?org=491
492;Санаторий «Озеро Карачи»;Новосибирская область;;632224, Новосибирская область, Курортный поселок Озеро Карачи, ул. Школьная, 1;http://www.okarachi.ru/;+7 (800) 250-49-96, +7 (38367) 41-145, 41-644;;okarachi@mail.ru;Салин Виктор Викторович;общество с ограниченной ответственностью;https://sanatoria.ru/san.php?org=492
493;Санаторий «Салют»;Краснодарский край;Сочи;354067, Краснодарский край, г. Сочи, ул. Санаторная, д. 49;http://salut-sochi.ru/;+7 (8622) 53-54-83;;;;;https://sanatoria.ru/san.php?org=493
494;Санаторий «Узбекистан»;Ставропольский край;Кисловодск;357741, Ставропольский край, г. Кисловодск, пр. Мира, 21;;+7 (87937) 3-12-24, 3-13-85, 3-03-95;3-07-66;Tachkent@narzan.com;;;https://sanatoria.ru/san.php?org=494
495;Санаторий «Черноморец»;Краснодарский край;Геленджик;353470, Краснодарский край, г. Геленджик, ул. Луначарского, 128;;+7 (86141) 3-37-86, 7-12-74;7-12-54;office@kubkurort.ru;Щербакова Елена Ивановна;общество с ограниченной ответственностью;https://sanatoria.ru/san.php?org=495
496;Санаторий «Малая бухта»;Краснодарский край;Анапа ул. Таманская;353440, Краснодарский край, г. Анапа ул. Таманская, д. 4;http://malbuhta.ru/;+7 (86133) 4-27-77, 4-63-57;4-27-77, 4-06-22;malaya-buhta@mail.ru;Исакидис Георгий Георгиевич;закрытое акционерное общество;https://sanatoria.ru/san.php?org=496
497;ЗАО «Пансионат с лечением „Сосновая роща“»;Краснодарский край;Геленджик;343460, Краснодарский край, г. Геленджик, ул. Маячная, 9;http://kubkurort.ru/;+7 (86141) 7-12-74, 7-12-73;3-37-85;office@kubkurort.ru;Савенко Иван Владимирович;закрытое акционерное общество;https://sanatoria.ru/san.php?org=497
498;Пансионат «Шепси»;Краснодарский край;;352815, Краснодарский край, Туапсинский р-н, пос. Шепси;http://pansionat-shepsi.ru/;+7 (861) 676-35-79, +7 (918) 009 71 12;;shepsi.dir@mail.ru;Певчик Константин;общество с ограниченной ответственностью;https://sanatoria.ru/san.php?org=498
499;Санаторий «Радуга»;Республика Татарстан;;423802, Республика Татарстан, Елабужское лесничество, Национальный парк «Нижняя Кама», правый берег р. Кама;http://lokraduga.ru/;+7 (8552) 20-56-26, +7(8552)20-50-75, +7(8552)20-50-72;;amv@lokraduga.ru;Синтишевский Дмитрий Сергеевич;закрытое акционерное общество;https://sanatoria.ru/san.php?org=499
500;Санаторий «Ай»;Республика Башкортостан;;452530, Республика Башкортостан, Дуванский район, с. Месягутово, корпус Сосновый Бор;http://xn----7sbab2bgc0akugp.xn--p1ai/;+7 (34798) 2-20-31, 2-20-41;2-20-63;sanatoriy-ai@ya.ru;Мошков Андрей Владимирович;общество с ограниченной ответственностью;https://sanatoria.ru/san.php?org=500
501;Санаторий «Черемшаны-1»;Саратовская область;Хвалынск-4;412780, Саратовская область, г. Хвалынск-4, санаторий «Черемшаны-1»;http://san-cheremshan1.narod.ru/;+7 (84595) 2-41-46, 2-41-17;2-41-44;anm980@rambler.ru;Павлов Николай Петрович;закрытое акционерное общество;https://sanatoria.ru/san.php?org=501
502;Санаторий «Голубая горка» филиал ООО «Газпром трансгаз Москва»;Краснодарский край;Сочи;354037, Краснодарский край, г. Сочи, Хостинский район, ул. Шоссейная, 15;http://golubayagorka.ru/;+7 (8622) 65-13-20, 65-13-19, 65-13-22;65-13-19, 65-13-22;info@sochi.mtg.gazprom.ru;Шмаков Виктор Георгиевич;филиал ООО «Газпром трансгаз Москва»;https://sanatoria.ru/san.php?org=502
503;Санаторий «Балтийский берег»;г. Санкт-Петербург;Зеленогорск;197720, г. Санкт-Петербург, Курортный р-н, г. Зеленогорск, ул. Курортная, д. 1;http://baltbereg.info/;+7 (812) 433-54-90, +7 (812) 454-14-14, +7 (812) 301-98-50;;contact@baltbereg.info;Ляшко Александр Дмитриевич;Государственные унитарные предприятия субъектов Российской Федерации (код 65242 по ОКОПФ);https://sanatoria.ru/san.php?org=503
504;МУЗ «Городской санаторий-профилакторий»;;Заречный;442960, г. Заречный, Пензенской области, ул. Заречная, 19;;+7 (8412) 603-507, 602-905;605-300;sanatori@zato.ru;Шевцова Валентина Александровна;муниципальная;https://sanatoria.ru/san.php?org=504
505;Клинический санаторий «Приокские дали»;;;140550, Московская обл., Луховицкий район, с. Алпатьево, ул. Санаторная;;+7 (49663) 58-6-06, 58-6-10;58-6-02;sekretar_spd@gavril.mtg.gazprom.ru;Соколов Александр Владимирович;обособленное структурное подразделение;https://sanatoria.ru/san.php?org=505
506;Санаторий «Белые ночи»;г. Санкт-Петербург (Сестрорецк);Санкт-Петербург (Сестрорецк);197706, г. Санкт-Петербург (Сестрорецк), 38-й км Приморского шоссе, дом 2 литера А;http://www.white-nights.ru/;+7 (812) 437-21-36 (для жителей СПб), +7 (800) 200-11-41 (по России), +7 (812) 318-64-00;+7 (812) 437-36-32;sanbelnochi@zdrav.spb.ru;санатория, заслуженный врач РФ, кандидат медици;Санкт-Петербургское государственное автономное учреждение здравоохранения;https://sanatoria.ru/san.php?org=506
507;Санаторий «Янтарный берег»;;Светлогорск;238560, г. Светлогорск, Калининградской области, Калининградский пр. 79А;http://yantarbereg.ru/;+7 (4 0153) 215-69, 216-04, 211-88;215-78;info@yantarbereg.ru;;общество с ограниченной ответственностью;https://sanatoria.ru/san.php?org=507
508;Детский санаторий «Изоплит», Екатеринбург;;Екатеринбург;620033, г. Екатеринбург, ул. Фабричная, 1 А;http://smileizoplit.ru/;+7 (900) 207-70-40, +7 (343) 341-38-26, +7 (343) 341-78-04;341-78-04;client@smileizoplit.ru;Батюкова Наталья Викторовна;автономная некоммерческая организация;https://sanatoria.ru/san.php?org=508
509;ФГУ «Санаторий „Марьино“»;;;307341, Курская обл., Рыльский р-н, п. Марьино;;+7 (495) 625-89-32, (4712) 51-49-70, (47152) 51-49-70;623-76-59;marino1923@mail.ru;Подолько Олег Ефимович;государственное учреждение;https://sanatoria.ru/san.php?org=509
510;Базовый санаторий имени;Краснодарский край;Геленджик;353460, Краснодарский край, г. Геленджик, ул. Маячная, д. 1;http://lomonosov-sea.ru/;+7 (86141) 3-36-81, 3-38-87;;m.v.lomonosov@rambler.ru;Алейников Николай Яковлевич;закрытое акционерное общество;https://sanatoria.ru/san.php?org=510
511;Санаторий «Заря»;Ставропольский край;Кисловодск;357700, Ставропольский край, г. Кисловодск, ул. Прудная, д. 107;http://sanzarya.ru/;+7 (87937) 2-11-07, 2-11-14;2-11-09;market@sanzarya.ru;Елизаров Александр Николаевич;федеральное государственное бюджетное учреждение;https://sanatoria.ru/san.php?org=511
512;Санаторий «Детскосельский»;Санкт-Петербург. г. Пушкин;;196634, Санкт-Петербург. г. Пушкин, Детскосельский, ул. Центральная, д. 17, лит. А;http://sanatoriy.su/;+7 (812) 452-58-88, 459-76-18;452-58-88;vgpalagnuk@mail.ru;Палагнюк Виктор Георгиевич;СПК;https://sanatoria.ru/san.php?org=512
513;Санаторий «Светлана» — сочинский филиал АО «ЦСТЭ»;Краснодарский край;Сочи;354002, Краснодарский край, Хостинский район, г. Сочи, Курортный просп., 75;http://svetlana-sochi.ru/;+7 (862) 444-08-45, +7 (862) 444-09-25, +7 (862) 44-44-902;;bron@svetlana-sochi.ru;Фролов Алексей Анатольевич;филиал акционерного общества;https://sanatoria.ru/san.php?org=513
514;Санаторий «Виктория»;Ставропольский край;Кисловодск;357700, Ставропольский край, г. Кисловодск, ул. Кирова, 12;http://victoria-kmv.ru/;+7 (87937) 9-42-50, +7 (800) 250-60-63;;cste@bk.ru;-главный врач;акционерное общество;https://sanatoria.ru/san.php?org=514
515;Санаторий «Абырал»;Республика Якутия;Якутск;677008, Республика Якутия, г. Якутск, Сергеляхское шоссе, 11 км, корпус 1;http://abyralykt.ru/;+7 (4112) 36-86-03, 36-91-58, 36-93-39;36-86-03;abral2001@list.ru;Иванова Алена Николаевна;автономная некоммерческая организация;https://sanatoria.ru/san.php?org=515
516;Детский санаторный комплекс «Жемчужина России»;Краснодарский край;;353417, Россия, Краснодарский край, город-курорт Анапа, Пионерский проспект, 253;http://www.gemrussia.ru/;+7 (61133) 33- 1- 84, 33-6-11;33-9-05;gemanapa@list.ru;Димоев Валерий Алексеевич;ООО;https://sanatoria.ru/san.php?org=516
517;ООО «Санаторий „Парус“»;Краснодарский край;Анапа;353423, Россия, Краснодарский край, г. Анапа, Пионерский проспект, 114;http://www.anapa-parus.ru/;+7 (86133) 3-37-90, 3-38-90;3-37-25, 3-36-71;parus_anapa@mail.ru;Фролов Андрей Андреевич;ООО;https://sanatoria.ru/san.php?org=517
518;ЗАО «Детский санаторно-оздоровительный лагерь „Кавказ“»;Краснодарский край;Анапа Пионерский проспект;353444, Краснодарский край, город Анапа Пионерский проспект, 49;;+7 (86133) 3-33-06, 3-31-32;3-31-32;anapakavkaz@mail.ru;Лледнева Людмила Савельевна;ЗАО;https://sanatoria.ru/san.php?org=518
519;Детский туберкулёзный санаторий «Пушкинский»;Санкт-Петербург;Пушкин;196602, Санкт-Петербург, г. Пушкин, ул. Парковая, д. 2/1;http://pushkinsky.net/;+7 (812) 465-39-09, 465-29-36;;pushkinskiy@list.ru;Карасёв Геннадий Геннадьевич;федеральное государственное бюджетное учреждение;https://sanatoria.ru/san.php?org=519
520;Пансионат с лечением «Эдем»;;Сочи;354002, г. Сочи, пр. Пушкина, д. 2;http://www.sochi-edem.ru/;+7 (8622) 62-17-80;62-17-90;1kp@mail.ru;Магоматов Риз Мовлаевич;ЗАО;https://sanatoria.ru/san.php?org=520
521;Санаторий «Лаго-Наки»;Республика Адыгея;;385781, Республика Адыгея, Майкопский район, хутор Красный мост, улица Шоссейная, дом 20;http://www.lagonaki.com/;+7 (861) 212-34-43, +7 (960) 499-19-19 (WA);;bron@lagonaki.com;Четаева Галина Сергеевна;филиал акционерного общества;https://sanatoria.ru/san.php?org=521
522;ФГУ санаторий «Байкал» ФСБ Листвянка;;;664521, РФ, Иркутская обл., Иркутский район, р. п. Листвянка;;+7 (3952) 490-373, 490-433, 112-412, 112-174;490-299;sanbaikal@inbox.ru;;ФГУ;https://sanatoria.ru/san.php?org=522
523;ФГУ центральный клинический санаторий им.;Краснодарский край;Сочи;354010, РФ, Краснодарский край, г. Сочи, ул. Виноградная, д. 35;;+7 (8622) 53-04-97;53-04-87;;;ФГУ;https://sanatoria.ru/san.php?org=523
524;Оздоровительный комплекс «Прометей» Небуг;Краснодарский край;;352831, Краснодарский край, Туапсинский район, п. Небуг О К «Прометей»;http://www.ok-prometey.ru/;+7 (86167) 98-151, 98-316;98-151, 98-316;marketing@ok-prometey.ru;Замураев Валерий Анатольевич;филиал;https://sanatoria.ru/san.php?org=524
525;Клинический санаторий «Барвиха» Подмосковье;Московская область;;143083, Московская область, Одинцовский район, санаторий «Барвиха»;http://www.barvihamed.ru/;+7 (495) 635-66-06;635-99-06;ame@barvihamed.ru;Молчанов Константин Иванович;Федеральное государственное учреждение;https://sanatoria.ru/san.php?org=525
526;Оздоровительный центр;;;152986, Ярославская обл., Рыбинский район, д. Дегтярицы, д. 101;http://vybordeti.ru/;+7 (485) 520-49-00, +7 930 121-03-46, +7 961 025-30-34;;v-yarzdrav@yandex.ru;;;https://sanatoria.ru/san.php?org=526
527;ООО Санаторий-профилакторий «ТОМНА»;;Кинешма;155810, г. Кинешма, Ивановская обл., ул. Веснина, д.7а;;+7 (49331) 9-53-52, 9-53-54;9-51-68;santomna90@mail.ru;Купцова Наталья Анатольевна;ООО;https://sanatoria.ru/san.php?org=527
528;ЗАО «Санаторий Светлана»;г. Москва;Москва;129336, г. Москва, ул. Таёжная, д. 1;http://www.san-svetlana.ru/;+7 (495) 276-23-33, 651-93-57;457-31-17;info@san-svetlana.ru;Левит Аркадий Олегович;ЗАО;https://sanatoria.ru/san.php?org=528
529;Санаторий «Радуга»;Республика Башкортостан;Уфа;450092, Республика Башкортостан, г. Уфа, ул. Авроры, 14/1;http://www.spraduga.ru/;+7 (347) 256-25-04, 256-25-08, 254-41-48;;raduga1966@yandex.ru;Шамсутдинов Альберт Рашитович;;https://sanatoria.ru/san.php?org=529
530;Санаторий «Плаза»;Ставропольский край;Кисловодск;357800, Ставропольский край, г. Кисловодск, пр. Ленина, д. 26−28;http://plazaspa.net/kislovodsk;+7 (800) 775-44-00, +7(87937)9-34-00;;plaza@plazaspa.net;Азарова Марина Александровна;общество с ограниченной ответственностью;https://sanatoria.ru/san.php?org=530
531;АНО «Санаторий «Свободный»;Амурская область;Свободный;676450, Амурская область, г. Свободный, ул. Куйбышева, 32;http://www.sanatorii-svobodnyi.ru/;+7 (41643) 3-23-25, 3-23-11;3-24-55;ano@amur.ru;;;https://sanatoria.ru/san.php?org=531
532;Санаторий «Красная Талка»;Краснодарский край;Геленджик;353460, Краснодарский край, г. Геленджик, ул. Мира, 38;http://www.talka.ru/;8 800 700-79-77 (бесп. звонок), +7 (86141) 4-00-60;;zakaz@talka.ru;Димитриев Константин Триондофилович;открытое акционерное общество;https://sanatoria.ru/san.php?org=532
533;Теплоход «Михаил Фрунзе»;;Нижний Новгород;603001, г. Нижний Новгород, пл. Маркина, д. 15а;http://www.vftour.ru/;+7 (831) 461-80-26, 461-82-29;461-80-30, 461-80-27;vftour@sandy.ru;Наумов Владимир;общество с ограниченное ответственностью;https://sanatoria.ru/san.php?org=533
534;Санаторий-профилакторий «Монди»;Республика Коми;Сыктывкар;167026, Республика Коми, г. Сыктывкар, ул. Мира, д. 23;http://vitaslpk.ru/;+7 (8212) 69-85-19, 69-92-02, +7 (912) 861-28-16;69-81-83;Vera.Bender@mondigroup.com;;акционерное общество;https://sanatoria.ru/san.php?org=534
535;Санаторий «Омский» — центр реабилитации Фонда Социального;;Омск;644012, г. Омск, ул. Березовая, 1;http://www.sanom.ru/;+7 (3812) 24-25-88, 24-26-34;24-28-73;sanom@mail.ru;Зюзько Елена Владимировна;Учреждение;https://sanatoria.ru/san.php?org=535
536;ОАО «Ульяновсккурорт»: санаторий Им.;;Ульяновск;432063, г. Ульяновск, ул. Карла Маркса, 5;http://www.ulkurort.ru/;+7 (8422) 41-05-00, 41-04-13;41-70-46;info@ulkurort.ru;Дунаев Ростислав Андреевич;ОАО;https://sanatoria.ru/san.php?org=536
537;Санаторий-профилакторий «Родник»;Иркутская область;Ангарск;665825, Иркутская область, г. Ангарск, ул. Чайковского, 51, ОАО «Ангарская нефтехимическая компания» санаторий-профилакторий «Родник»;;+7 (3955) 57-17-01, 57-17-10;57-17-00;of59@anhk.rosneft.ru;Распопин Юрий Анатольевич;открытое акционерное общество;https://sanatoria.ru/san.php?org=537
538;ГУ санаторий «Бэс Чагда»;Московская область;;143030, Московская область, Одинцовский р-н, пос. Сосны, строение 1;http://www.bes-chagda.ru/;+7 (495) 630-22-08, 651-45-15, 630-22-20;651-45-15;bes-chagda@mtu-net.ru;Ефремова Любовь Дмитриевна;государственное учреждение;https://sanatoria.ru/san.php?org=538
539;Санаторий-профилакторий «Янтарь» ОАО «РЖД»;Калининградская область;Светлогорск;238560, Калининградская область, г. Светлогорск, ул. Ленина, 50;http://www.sanatyantar.ru/;+7 (40153) 21-608, 21-609;22-659;san-yantar@mail.ru;Никулин Андрей Иванович;ОАО;https://sanatoria.ru/san.php?org=539
540;Санаторий-профилакторий «Лукоморье»;Оренбургская область;;462803, Оренбургская область, Новоорский район, п. Энергетик, д. 49;http://sp-lukomorie.ru/;+7 (35363) 4-27-97, 4-32-33;4-27-97;sev-splukomorie@mail.ru;Семёнова Елена Викторовна;открытое акционерное общество;https://sanatoria.ru/san.php?org=540
541;Санаторий Лунево на Волге;;;156539, Костромская обл., Костромской р-н, п/о Сухоногово;http://www.lunevo.ru/;+7 (4942) 66-42-10, 66-42-02;66-42-10;lunevo@yandex.ru;Беляков Андрей Алексеевич;ООО;https://sanatoria.ru/san.php?org=541
542;Санаторий «Ташир»;;Сочи;354217, г. Сочи, п. Лазаревское, пер. Павлова, 19;http://www.sochi.tashir.com/;+7 (8622) 70-95-14, 70-95-16;90-60-41;tashir_s@mail.ru;Кривенда Елена Леонидовна;ООО;https://sanatoria.ru/san.php?org=542
543;Санаторий «Родник»;Краснодарский край;;353456, Краснодарский край, г-к Анапа, Пионерский проспект, 30;http://anapa-rodnik.com/;+7 (86133) 3-37-53, +7(800)100-18-02;;san_rodnik@mail.ru;Кузьменко Владимир Сергеевич;открытое акционерное общество;https://sanatoria.ru/san.php?org=543
544;Клинический санаторий «Волга»;Самарская область;Самара;443029, Самарская область, г. Самара, Седьмая просека;http://skkcvo.ru/sanatorii/klinicheskij-sanatorij-volga/;+7 (800) 100-13-15, +7 (846) 994-53-58, +7 (846) 994-40-16;;volga.pytevka@mail.ru;;федеральное государственное бюджетное учреждение;https://sanatoria.ru/san.php?org=544
545;Санаторий-профилакторий «Серебряный меридиан»;Свердловская область;Североуральск;624480, Свердловская область, г. Североуральск, ул. Ватутина, д. 5а;http://xn--80abjcabvbf4ajh2aceg0puc.xn--p1ai/;+7 (34380) 4-28-98, 4-28-99;4-20-42;larisa.arslanova@rusal.com;Добрин Андрей Леонидович;общество с ограниченной ответственностью;https://sanatoria.ru/san.php?org=545
