id;name;region;city;address;website;phone;fax;email;director;legal_form;source_url
1;Санаторий «Москва»;Краснодарский край;Сочи;354002, Краснодарский край, г. Сочи, ул. Депутатская, 10;;+7 (8622) 62-25-10, 62-31-01;92-32-82;sanmoscow2004@mail.ru;Берлизов Петр Витальевич;ЗАО;https://sanatoria.ru/san.php?org=1
2;Санаторно-оздоровительный центр «Карачарово»;Тверская область;;171283, Тверская область, Конаковский р-н, п/о Карачарово, д. Карачарово;http://karacharovotver.ru/;+7 (48242) 6-86-19, 6-87-38, (4822) 35-38-42, (4822) 45-60-10;(48242) 4-30-77;karacharovo@mail.ru;Кутузов Павел Андреевич;ЗАО;https://sanatoria.ru/san.php?org=2
3;Чебаркульский военный санаторий;Челябинская область;Чебаркуль;456440, Челябинская область, г. Чебаркуль;http://sanatoriy.chebarkulskiy.ru/;+7 (35168) 6-23-37, 6-22-94;+7 (35168) 6-23-37;sanatory.chebarkulski@mail.ru;;федеральное государственное бюджетное учреждение;https://sanatoria.ru/san.php?org=3
4;Лечебно-реабилитационный клинический центр «Юдино»;;;143081, Московская обл., Одинцовский р-н, Юдино с., ул. Красная, 23;http://udino.nmicrk.ru/;+7 (495) 926-11-96, +7 (495) 598-83-54;598-83-54, 203-86-50;rkmrik@mail.ru;Полунин Алексей Андреевич;федеральное государственное бюджетное учреждение;https://sanatoria.ru/san.php?org=4
5;Санаторий «Маяк»;Краснодарский край;Анапа;353440, Краснодарский край, г. Анапа, ул. Кирова, 2;http://mayak-anapa.ru/;+7 (86133) 4-35-11, 5-81-62;4-35-11;anapamayak@mail.ru;Сурков Сергей Геннадьевич;ЗАО;https://sanatoria.ru/san.php?org=5
6;Санаторий «Лаба»;Краснодарский край;Лабинск;352500, Краснодарский край, г. Лабинск, ул. Водоисточная, 1;http://san-lab.ru/;+7 (800) 555-13-20, +7(86169)6-02-75, +7(86169)6-03-05;;market@san-lab.ru;Шахматов Анатолий Иванович;открытое акционерное общество;https://sanatoria.ru/san.php?org=6
7;Клинический санаторий Главмосстроя «Валуево»;;;142780, Московская обл., Ленинский р-н, пос. Валуево;http://www.valuevo.ru/;+7 (495) 436-67-01, 436-82-89;436-60-09;valuevo@mail.ru;Топоркова Елена Михайловна;ОАО;https://sanatoria.ru/san.php?org=7
8;Пансионат с лечением «Нива»;Краснодарский край;Анапа;353440, Россия, Краснодарский край, г. Анапа, ул. Крымская, 22;http://www.niva1.inc.ru/;+7 (86133) 5-01-28, 5-82-52, 5-62-17;5-01-28;niva1@mail.ru;Макаренко Александр Алексеевич;общество с ограниченной ответственностью;https://sanatoria.ru/san.php?org=8
9;Пансионат с лечением «Приморский»;Краснодарский край;;353480, Краснодарский край, Геленджикский р-н, пос. Кабардинка, ул. Мира, 5;;+7 (86141) 65-6-72;65-2-86;;Озеров Андрей Валерьевич;ООО;https://sanatoria.ru/san.php?org=9
10;Санаторий «Тогучинский»;;Тогучин;633456, Новосибирская обл., г. Тогучин, ул. Заводская, 142;;+7 (38340) 22-982, 22-284;22-282;togsan@bk.ru;Кирикова Галина Михайловна;ОАО;https://sanatoria.ru/san.php?org=10
11;Санаторий «Авитек»;;Киров;610011, г. Киров, Северная Набережная, д. 3;http://medavitek.ru/;+7 (8332) 24-58-59, 24-58-69;24-58-61;medavitek@mail.ru;;общество с ограниченной ответственностью;https://sanatoria.ru/san.php?org=11
12;Центральный военный клинический санаторий «Сочи» им. Я. Фабрициуса;Краснодарский край;Сочи;354002, Краснодарский край, г. Сочи, Курортый пр., 85;;+7 (8622) 92-76-45, 99-42-96;92-52-50;VoenSan@Sochi.ru;;ГУ;https://sanatoria.ru/san.php?org=12
13;Санаторий «Лесное озеро»;Московская область;;141590, Московская область, Солнечногорский р-он, поселок «Лесное озеро»;http://www.fa.ru/org/div/uok/Pages/About.aspx;+7 (495) 249-52-88, +7(496)266-58-50​;;lesnoeozero@fa.ru;Новиков Вячеслав Иванович;ОАО;https://sanatoria.ru/san.php?org=13
14;Шмаковский военный санаторий;Приморский край;;692086, Приморский край, Кировский район, п. Горные ключи, ул. Санаторная, 2;;+7 (42354) 24-2-70, 24-1-59;24-2-70;sanatshmakovka@mail.ru;;федеральное государственное учреждение;https://sanatoria.ru/san.php?org=14
15;Санаторий «Удельная»;;;140140, Московская обл., Раменский район, пос. Удельная, ул. Кривоколенная, 42;http://sanatoriyudelnaya.ru/;+7 (495) 902-69-05, +7 (800) 100-35-45;;zakaz@udelnaya.com;Бодрова Людмила Николаевна;общество с ограниченной ответственностью;https://sanatoria.ru/san.php?org=15
16;Санаторий-профилакторий «Радуга» ОАО «РЖД»;Приморский край г. Уссурийск ул.Попова;;692510, Приморский край г. Уссурийск ул.Попова, 33;;+7 (4234) 36-42-93, 34-46-28;36-56-44;;Жуков Николай Геннадьевич;ОАО;https://sanatoria.ru/san.php?org=16
17;Пансионат с лечением «Пахра»;Московская область;;142144, Московская область, Подольский район, п/о Щапово, пансионат «Пахра»;;+7 (495) 996-83-33, 659-43-48;996-59-84;desna@umail.ru;Коваленко Петр Иванович;ГУ;https://sanatoria.ru/san.php?org=17
18;ФГУ «Объединенный санаторий и дом отдыха „Десна“»;;;142793, Московская обл., Ленинский р-н, п/о Ватутинки, ФГУ ОСДО «Десна»;http://desna-udp.ru/;+7 (495) 659-43-93, 659-43-48;659-42-00;info@desna-udp.ru;Торохов Александр Иванович;ФГУ;https://sanatoria.ru/san.php?org=18
19;Санаторий «Кубань»;Краснодарский край;Анапа;353440, Краснодарский край, г. Анапа, ул. Пушкина, д. 30;http://www.anapa-kuban.ru/;+7 (86133) 5-26-48, 4-61-09;5-42-26;kubananapa@mail.ru;Стремоусов Сергей Георгиевич;закрытое акционерное общество;https://sanatoria.ru/san.php?org=19
20;Санаторий «Зеленый городок» Ивановская область;;;153535, Ивановская обл., Ивановский р-н, поселок Ломы;http://zelgorodok.ru/;+7 (4932) 31-47-18, 31-47-35;;zel-gorodok@bk.ru;Попова Наталья Юрьевна;общество с ограниченной ответственностью;https://sanatoria.ru/san.php?org=20
21;Санаторий им.;Ставропольский край;Пятигорск;357500, Ставропольский край, г. Пятигорск, бульвар Гагарина, 39;http://www.kirova-kmv.ru/;+7 (8793) 33-83-21, 36-34-91;33-83-21;bron@kirova-kmv.ru;Ушаков Сергей Васильевич;федеральное государственное бюджетное учреждение здравоохранения;https://sanatoria.ru/san.php?org=21
22;Санаторий «Дубрава»;Орловская область;;302530, Орловская область, Орловский р-он, д. Жилина;http://dubravaorel.ru/;+7 (4862) 43-30-09, 42-40-05;42-26-82;dubrava@orel.ru;Гадецкий Олег Борисович;Государственное унитарное предприятие Орловской области;https://sanatoria.ru/san.php?org=22
23;Санаторий «Красноярское Загорье»;Красноярский край;;662355, Красноярский край, Балахтинский р-н, с. Кожаны, здание 39;http://zagorie.ru/;+7 (39148) 37-5-71, 37-19-7;;zagorie@zagorie.ru;Сластина Татьяна Викторовна;акционерное общество;https://sanatoria.ru/san.php?org=23
24;Санаторий-профилакторий «Орбита»;;Курчатов;307250, Курская обл., г. Курчатов, ул. Сосновая, 2;;+7 (47131) 4-88-88, 5-43-91;4-88-88;;Лысенко Николай Васильевич;ГУ;https://sanatoria.ru/san.php?org=24
25;ООО «Санаторий „Одиссея“»;Краснодарский край;Сочи;354200, Россия, Краснодарский край, г. Сочи, Л -200, ул. Сочинское шоссе, 28;http://www.odisseya.com/;+7 (8622) 79-13-08, 79-10-50, 72–12–17;72-11-01;odisseya@odisseya.ru;Михайлов Анатолий Владимирович;ООО;https://sanatoria.ru/san.php?org=25
26;ФГУ детский санаторий «Васильевское»;Московская область;;143088, Московская область, Одинцовский район, поселок санатория им. Герцена;http://dsvas.ru/;+7 (495) 992-14-23, 992-14-36;992-14-23;9921423@mail.ru;Чекета Гейза Иванович;федеральное государственное учреждение;https://sanatoria.ru/san.php?org=26
27;Санаторий «Радуга»;Краснодарский край;Сочи;354008, Россия, Краснодарский край, г. Сочи, ул. Виноградная, 53;;+7 (8622) 59-75-02, 59-75-27;59-01-30, 59-72-22;;Рыжков Игорь Алексеевич;ГУ;https://sanatoria.ru/san.php?org=27
28;Санаторий «Итиль»;Ульяновская область;Ульяновск;432010, Ульяновская область, г. Ульяновск, ул. Оренбургская, д. 1;http://www.itilsanatorium.ru/;+7 (8422) 27-83-90, 27-83-92;27-83-90;buhitil@mail.ru;Емельянцева Наталья Федоровна;акционерное общество;https://sanatoria.ru/san.php?org=28
29;Санаторий «Пугачевский»;Саратовская область;;413709, Саратовская область, Пугачевский район, пос. Заречный;http://pugachevsky.ru/;+7 (84574) 3-17-28, 3-17-26;317-00;pugachevsky@narod.ru;;ГУ;https://sanatoria.ru/san.php?org=29
30;Санаторий «Автомобилист»;Нижегородская область;;606480, Нижегородская область, Борский район, Редькинский сельсовет, санаторий «Автомобилист»;http://xn--80aaaee8adaeyigoebzmqfgi.xn--p1ai/;+7 (831) 415-89-83, 415-56-73;463-85-87;avtomobilist.nnov@yandex.ru;Дурандин Валерий Николаевич;открытое акционерное общество;https://sanatoria.ru/san.php?org=30
31;МУП «Санаторий «Дальняя Дача»;Челябинская область;Кыштым;456870, Челябинская область, г. Кыштым, ул. Дальняя, дом 2.;http://www.dalnaya.ru/;+7 (35151) 4-94-55, 4-94-58;4-94-51;d_dacha@list.ru;Кривцова Елена Владимировна;Муниципальное учреждение;https://sanatoria.ru/san.php?org=31
32;Санаторий «Северная Ривьера»;г. Санкт-Петербург;Санкт-Петербург;197720, г. Санкт-Петербург, Зеленогорск, Приморское шфоссе, 570;http://www.kurortriviera.ru/;+7 (812) 433-31-55, 433-57-30;433-55-50;riviera.kurort@lek.ru;Ждан Ирина Леонидовна;ЗАО;https://sanatoria.ru/san.php?org=32
33;Белгородский областной центр восстановительной медицины и реабилитации;Белгородская область;Белгород;308012, Белгородская область, г. Белгород, ул. Костюкова, 67;;+7 (7722) 55-03-04, 54-56-05;54-56-05;OCWL@belgtts.ru;Свергузов Ануар Мезгутович;ГУ;https://sanatoria.ru/san.php?org=33
34;ООО «Санаторий „Митино“»;Тверская область;;172061, Тверская область, Торжокский р-н, п/о Митино, д. Митино;http://www.sanatory-mitino.ru/;+7 (48251) 6-43-36, 6-44-77;6-43-33;mitinoeo@torzhok.tver.ru;Коновалова Зоя Александровна;ООО;https://sanatoria.ru/san.php?org=34
35;Санаторий «Зеленая роща»;Республика Башкортостан;Уфа;450022, Республика Башкортостан, г. Уфа, ул. Менделеева, д. 136/5;http://www.green-kurort.ru/;+7 (800) 200-21-90, +7 (347) 225-25-30, +7 (347) 200-82-91;;green-kurort.ru@green-kurort.ru;Байтеряков Фиял Рифович;общество с ограниченной ответственностью;https://sanatoria.ru/san.php?org=35
36;Санаторий «Якты-Куль»;Республика Башкортостан;;453629, Республика Башкортостан, Абзелиловский район, д. Якты-Куль;http://xn----7sba6afhaillwhqgq0kua1c.xn--p1ai/;+7 (347) 22-94-777, +7 (927) 938-19-65, +7 (3519) 33-05-05;;yak_market@mail.ru;Мигаль Максим Александрович;государственное унитарное предприятие;https://sanatoria.ru/san.php?org=36
37;Санаторий «Волжский Утёс» ФГБУ Управления делами;Самарская область;;446740, Самарская область, Шигонский р-он, поселок Волжский Утес, ФГБУ санаторий «Волжский утес»;http://volgacliff.ru/;+7 (84648) 5-16-25, 5-32-74;5-12-26;reserv@volgacliff.ru;Балакин Сергей Алексеевич;федеральное государственное бюджетное учреждение;https://sanatoria.ru/san.php?org=37
38;Санаторий «Старица»;Рязанская область;Рязань;390021, Рязанская область, г. Рязань, п. Солотча, ул. Владимирская, 95;http://staritsa.ru/;+7 (4912) 288-244 доб. 1280, +7 (800) 500-00-13 (бесп.);;bron@staritsa.ru;Агеева Екатерина Валерьевна;общество с ограниченной ответственностью;https://sanatoria.ru/san.php?org=38
39;Санаторий «Нижне-Ивкино»;;;610901, Кировская обл., Куменский р-н, п. Нижнеивкино, ул. Курортная, 1;http://www.n-ivkino.ru/;+7 (83343) 2-44-01, 2-44-02;2-44-43;n-ivkino@n-ivkino.ru;-главный врач;закрытое акционерное общество;https://sanatoria.ru/san.php?org=39
40;Санаторий «Хилово»;Псковская область;;182651, Псковская область, Порховский район, деревня Хилово, ул. Центральная, д. 1;http://hilovo.org/;+7 (800) 250-18-65, +7 (81134) 62-157 (приемная);;hiloffic@hilovo.org;Бергер Татьяна Вячеславовна;частное лечебно-профилактическое учреждение;https://sanatoria.ru/san.php?org=40
41;Санаторий-профилакторий «Волга» ФГУП «ПОЗИС»;;Зеленодольск ул. Гагарина;422540, Татарстан, город Зеленодольск ул. Гагарина, д. 1;http://www.sp-volga.ru/;+7 (84371) 5-76-47, 5-33-33;5-79-91;info@sp-Volga.ru;Кайль Владимир Фридрихович;ФГУП;https://sanatoria.ru/san.php?org=41
42;Санаторий «Надежда» ГУП;Республика Чувашия;Новочебоксарск;429951, Республика Чувашия, г. Новочебоксарск, ул. Набережная, 46;http://www.nadegda.ru/;+7 (8352) 77-06-26, 77-17-76;78-53-73;nadezhda_n@cbx.ru;- главный врач;ГУП;https://sanatoria.ru/san.php?org=42
43;Санаторий «Колос»;;;610901, Кировская обл., п/о Нижне-Ивкино, п. Колос;http://www.kolos.kirov.ru/;+7 (8332) 78-42-20, 48-68-68;(83354) 74-197;op-kolos@yandex.ru;Зорин Николай Афанасьевич;ООО;https://sanatoria.ru/san.php?org=43
44;Санаторий «Лесная Новь»;Кировская область;;610901, Кировская область, Куменский район, пгт. Нижнеивкино;http://lesnov.info/;+7 (83343) 2-33-12, 2-36-60;2-36-59;orpln@mail.ru;Горлов Иван Николевич;общество с ограниченной ответственностью;https://sanatoria.ru/san.php?org=44
45;Санаторий «Родник»;Ставропольский край;Пятигорск;357500, Россия, Ставропольский край, г. Пятигорск, бульвар Гагарина, д. 21;http://www.kmvrodnik.ru/;+7 (8793) 30-18-00, 30-17-83;30-18-15;info@kmvrodnik.ru;- главный врач;лечебно профилактическое учреждение профсоюзов;https://sanatoria.ru/san.php?org=45
46;ЗАО «Санаторий „Предгорье Кавказа“»;Краснодарский край;Горячий ключ;353292, Краснодарский край, г. Горячий ключ, ул. Ленина, 2;http://predgore-kavkaza.ru/;+7 (86159) 34-335, 36-157;35-400;sanatoriy@predgore-kavkaza.ru;Каркач Ольга Викторовна;ЗАО;https://sanatoria.ru/san.php?org=46
47;Санаторий «Уральская Венеция»;Пермская область;;618740, Пермская область, п. Добрянка, ул. Энергетиков, д. 33;http://venecia.perm.ru/;+7 (34265) 2-76-98, (3422)942-942;2-76-98;venecia_1@mail.ru;- главный врач;ООО;https://sanatoria.ru/san.php?org=47
48;ЛПУ профсоюзов «Санаторий им. М. Ю. Лермонтова»;Ставропольский край;Пятигорск;357501, Ставропольский край, г. Пятигорск, ул. Лермонтовская, 9;http://www.san-lerm.ru/;+7 (8793) 40-48-81, 33-95-66;39-06-97;san.lermontova@profkurort.ru;- главный врач;некоммерческая организация, учреждение общественных организаций;https://sanatoria.ru/san.php?org=48
49;Санаторий «Тинаки» центр реабилитации ФСС РФ;Астраханская область;;416131, Астраханская область, Наримановский район, село Рассвет;http://www.tinaki.ru/;+7 (8512) 57-90-54, 57-94-63;57-90-54;fgu_tinaki@astranet.ru;Брынцева Ирина Александровна;федеральное государственное учреждение;https://sanatoria.ru/san.php?org=49
50;Санаторий «Надежда»;;Ростов-на-Дону;344068, Ростовская обл., г. Ростов-на-Дону, ул. Подъездная, 55;;+7 (863) 245-20-22, 245-23-18, 245-99-74;240-20-22, 245-20-22;nadezda.rost@mail.ru;Бояджян Артур Амбарцумович;ОАО;https://sanatoria.ru/san.php?org=50
51;Геокурорт «Янган-Тау»;Республика Башкортостан;;452492, Республика Башкортостан, Салаватский район, с. Янгантау, ул. Центральная, 20;http://yantau.ru/;+7 (347) 200 8308, +7(800)707 50 14;;yantau@mail.ru;Акбашев Альфред Рашитович;акционерное общество;https://sanatoria.ru/san.php?org=51
52;ЗАО «Санаторий „Ерино“»;;;142102, Московская обл., Подольский р-н, п. Ерино;http://www.erino.su/;+7 (4967) 67-51-75, (495) 715-91-32;67-51-71;erino@bk.ru;Титов Леонид Борисович;ЗАО;https://sanatoria.ru/san.php?org=52
53;Санаторий «Анапа»;Краснодарский край;Анапа;353444, Краснодарский край, г. Анапа, ул. Гребенская, 3;http://www.sananapa.ru/;+7 (86133) 5-68-52, 5-67-31;5-68-52;sananapa@mail.kuban.ru;Рогозян Алексей Борисович;акционерное общество;https://sanatoria.ru/san.php?org=53
54;Санаторий-профилакторий ОАО «Бассоль»;;;416532, Астраханская обл., Ахтубинский район, п. Нижний Баскунчак, ул. Максима Горького, 16;http://www.bassol.ru/;+7 (85141) 55-2-75, 55-6-32, 55–1–59;55–2–84, 55–1–47;bassol@astranet.ru;Демичев Евгений Петрович;ОАО;https://sanatoria.ru/san.php?org=54
55;ФГУ «Детский санаторий «Голубая Волна»;Краснодарский край;Анапа;353440, Россия, Краснодарский край, г. Анапа, пр. Революции, 13;;+7 (86133) 4-34-32, 3-29-96;4-34-32;golubay_volna@mail.ru;Нарушевич Роман Романович;ФГУ;https://sanatoria.ru/san.php?org=55
56;Санаторий-профилакторий «Алмед»;;Пермь;614032, г. Пермь, ул. Кировоградская, 112;http://almed.perm.ru/;+7 (8342) 252-70-42, 252-37-39;252-80-60;almed-perm@mail.ru;Федяев Александр Михайлович;общество с ограниченной ответственностью;https://sanatoria.ru/san.php?org=56
57;ЛПУ «Санаторий имени 30-летия Победы»;Ставропольский край;Железноводск;357416, Россия, Ставропольский край, г. Железноводск, ул. Ленина, 2а;http://www.s30p.ru/;+7 (87932) 4-23-59, 4-44-19, 6-19-87, +7 (800) 700-30-18;4-44-19;s30p@beshtau.ru;- главный врач;частное учреждение;https://sanatoria.ru/san.php?org=57
58;Санаторий-профилакторий «Салампи»;Республика Чувашия;Новечебоксарск;429951, Республика Чувашия, г. Новечебоксарск, ул. Набережная, 40;http://www.salampi.ru/;+7 (8352) 73-73-43, 73-73-18;73-73-43;salampy@rambler.ru;- главный врач;общество с ограниченной ответственностью;https://sanatoria.ru/san.php?org=58
59;Базовый республиканский детский реабилитационный центр «Радуга»;Кабардино-Балкарская Республика;Нальчик;360002, Кабардино-Балкарская Республика, г. Нальчик, пер. Сочинский, 2;http://raduga-nalchik.ru/;+7 (8662) 42-65-61, 42-18-38, 42-57-07;42-18-38;radugakbr@list.ru;Бжекшиев Сураждин Лолович;государственное учреждение;https://sanatoria.ru/san.php?org=59
60;Санаторий «Заполярье»;Краснодарский край;Сочи;354073, Россия, Краснодарский край, г. Сочи, ул. Пирогова, 10;http://www.zapolarye.ru/;+7 (8622) 599-512, 599-217, 599-495;531-626. 599-313;info@zapolarye.ru;Джелиев Заурбек Хасанбекович;ООО;https://sanatoria.ru/san.php?org=60
61;Санаторий «Ясная поляна»;Севастопольское шоссе;;298660, Республика Крым, городской округ Ялта, посёлок городского типа Гаспра, Севастопольское шоссе, 52А;http://polyana-crimea.ru/;+7 (3654) 24-27-75;;;;;https://sanatoria.ru/san.php?org=61
62;Санаторий «Изумрудный»;Краснодарский край;Горячий ключ;353290, Краснодарский край, г. Горячий ключ, ул. Ленина, д. 12;http://www.izum1.com/;+7 (86159) 3-47-81, 3-48-83;3-85-78, 3-48-83;izum-bron@mail.ru;Федоровский Иван Алексеевич;общество с ограниченной ответственностью;https://sanatoria.ru/san.php?org=62
63;Санаторий «Колос»;Ставропольский край;Кисловодск;357700, Ставропольский край, г. Кисловодск, пер. Яновского, д. 7;http://kolos-kmv.ru/;+7 (87937) 3-03-94, 3-11-12;3-03-94;koloskisl@gmail.com;Губский Николай Васильевич;общество с ограниченной ответственностью;https://sanatoria.ru/san.php?org=63
