id;name;region;city;address;website;phone;fax;email;director;legal_form;source_url
249;Санаторий-профилакторий «Ленёвка»;Свердловская область;;622911, Свердловская область, Пригородный район, п. Ленёвка;http://lenevka.ru/;+7 (3435) 49-74-59, +7 (3435) 49-74-48, +7 (3435) 49-74-74 (аквапарк);;reklama.spl@mail.ru;Ильина Римма Николаевна;частное учреждение;https://sanatoria.ru/san.php?org=249
250;Санаторий «Лесная поляна»;Ставропольский край;Пятигорск;357520, Ставропольский край, г. Пятигорск, Иноземцевское шоссе, 5;http://lespol.ru/;+7 (800) 700-56-73, +7 (8793) 40-56-72, +7 (8793) 40-56-73;;tenderlespol@profkurort.ru;;некоммерческая организация;https://sanatoria.ru/san.php?org=250
251;Санаторий-профилакторий «Родник»;Красноярский край;Ачинск;662150, Красноярский край, г. Ачинск, ул. Манкевича, д. 46;http://rodnik-achinsk.ru/;+7 (39151) 4-94-82, 4-97-26;;Marina.dubskay@mail.ru;Хвалько Сергей Васильевич;общество с ограниченной ответственностью;https://sanatoria.ru/san.php?org=251
252;Санаторий «Беларусь»;Краснодарский край;Сочи;354008, Краснодарский край, г. Сочи, ул. Политехническая, д. 62;http://sochi-belarus.ru/;+7 (862) 253-05-84, 253-48-85;253-16-02;belarus_polyana@mail.ru;Колесник Геннадий Леонидович;госудрственное учреждение;https://sanatoria.ru/san.php?org=252
253;Санаторий «Прокопьевский»;Кемеровская область;Прокопьевск;653021, Кемеровская область, г. Прокопьевск, ул. Парковая, 280Б;http://sanprokop.ru/;+7 (3846) 66-55-40, 66-55-40, +7 960 904-09-10;66-55-18;SanProkop@list.ru;Зайцев Николай Михайлович;публичное акционерное общество;https://sanatoria.ru/san.php?org=253
254;Многопрофильный медицинский комплекс «Matrёshka Plaza»;Самарская область;Самара;443051, Самарская область, г. Самара, ул. Енисейская, д. 62а;http://matreshkaplaza.com/;+7 (846) 933-30-30, 933-30-72;;bashirovane@sanamet.ru;обособленного подразделения;общество с ограниченной ответственностью;https://sanatoria.ru/san.php?org=254
255;Санаторий «Красная Глинка», Самара;Самарская область;Самара;443048, Самарская область, г. Самара, пос. Южный;http://sanatoriykrasnayaglinka.ru/;+7 (846) 998-55-66, 998-55-70;998-55-66;san.glinka@yandex.ru;Бабушкин Иван Михайлович;учреждение;https://sanatoria.ru/san.php?org=255
256;Санаторий «Курьи»;Свердловская область;;624810, Свердловская область, Сухоложский район, с. Курьи, ул. Батенева, 46;http://xn--h1adsl0c.su/;+7 (34373) 9-13-34, +7 (34373) 9-15-31, +7 (343) 227-95-50;;;Филимонов Павел Александрович;;https://sanatoria.ru/san.php?org=256
257;Санаторий «Надежда», Анапа;Краснодарский край;Анапа;353440, Краснодарский край, г. Анапа, ул. Калинина, д. 30;http://sanatoriy-nadezhda.online/;+7 (800) 511-61-74, +7(86133)3-24-98, +7(86133) 4-61-95;;anapanadejda@inbox.ru;Астапинко Геннадий Васильевич;закрытое акционерное общество;https://sanatoria.ru/san.php?org=257
258;Курортная поликлиника им.;Ставропольский край;Пятигорск;357500, Ставропольский край, г. Пятигорск, ул. Кирова 19;http://iskra-kmw.ru/;+7 (8793) 40-56-82, +7(800)700-84-21;;iskra@profkurort.ru;Меличко Раиса Ивановна;государственное учреждение;https://sanatoria.ru/san.php?org=258
259;Санаторий «Руш» областной специализированный центр медицинской реабилитации;Свердловская область;Нижний Тагил;622015, Свердловская область, г. Нижний Тагил, санаторий «Руш», 10;http://sanatoriy-rush.ru/;+7 (3435) 439-243, 439-248;439-243;sekretar@sanatoriy-rush.ru;Волкова Нина Петровна;государственное автономное медицинское учреждение Свердловской области;https://sanatoria.ru/san.php?org=259
260;Санаторий «Малые Соли»;;;152263, Ярославская обл., Некрасовский р-он, п/о Строитель, Санаторий «Малые Соли»;http://yarhotels.com/hotels/yarhotel-malye-soli/;+7 (48531) 33-1-17, +7 (901) 485-77-27;4-15-40;booking_yms@yarhotels.com;Шефова Нина Дмитриевна;Открытое акционерное общество;https://sanatoria.ru/san.php?org=260
261;Санаторий-профилакторий «Прометей» НПЦ «Полюс»;Томская область;;634522, Томская область, Томский р-н, Калтайское сельское поселение, окрестности с. Калтай;http://prometet.tom.ru/;+7 (3822) 96-72-18, 96-71-89;967230;prometey@mail.tomsknet.ru;- главный врач;"филиал ОАО ""НПЦ ""Полюс""";https://sanatoria.ru/san.php?org=261
262;Детский бронхолегочный санаторий № 8 Департамента здравоохранения города Москвы;Московская область;Бронницы;140171, Московская область, город Бронницы, деревня Марьинка;http://ds8mos.ru/;+7 (496) 466-52-33, +7 (916) 677-11-23, +7 (916) 616-11-75;;dbs8@zdrav.mos.ru;Дементьева Ирина Николаевна;государственное бюджетное учреждение здравоохранения;https://sanatoria.ru/san.php?org=262
263;Санаторно-курортный комплекс «Знание»;Краснодарский край;Сочи;354340, Краснодарский край, г. Сочи, А-340, ул. Просвещения, 139;http://skk-znanie.ru/;+7 (8622) 69-46-04, 69-46-41, 69-46-40;69-46-03, 69-46-02;znanie02@sochi.com;Яблонев Ростислав Иванович;общество с ограниченной ответственностью;https://sanatoria.ru/san.php?org=263
264;Санаторий «Сосновый бор»;Ульяновская область;Димитровград;433511, Ульяновская область, г. Димитровград, ул. Куйбышева д. 335;http://sobodim.ru/;+7 (84235) 4-80-48, 4-84-69;;manager@sobodim.ru;Юркевич Екатерина Алексеевна;общество с ограниченной ответственностью;https://sanatoria.ru/san.php?org=264
265;ФГБУ Санаторий им.;Ставропольский край;Ессентуки;357600, Ставропольский край, г. Ессентуки, ул. Разумовского, д. 16;http://sankalinin.org/;+7 (87934) 4-14-10 (отдел маркетинга), +7 (87934) 4-1402 (коммутатор), +7 (87934) 4-1385 (глав. врач);+7 (87934) 4-14-10;triada@sankalinin.org;Петрова Валентина Алексеевна;федеральное государственное учреждение;https://sanatoria.ru/san.php?org=265
266;Санаторий «Строитель»;Приморский край;Владивосток;690024, Приморский край, г. Владивосток, ул. Маковского, д. 121;http://sanstroitel.ru/;+7 (423) 238-80-33, 238-80-34;238-86-59;primss@mail.ru;Антипин Анатолий Геннадьевич;общество с ограниченной ответственностью;https://sanatoria.ru/san.php?org=266
267;СКУ cанаторий «Нарзан»;Ставропольский край;;357700, Ставропольский край, Кисловодск, Курортный бульвар, 19;http://sannarzan.ru/;+7 (87937) 2-59-51, 2-04-75;2-59-85;narzankg@narzan.com;- главный врач;учреждение;https://sanatoria.ru/san.php?org=267
268;Санаторий «Озон», г. Теберда;Карачаево-Черкесская Республика;Теберда;369210, Карачаево-Черкесская Республика, г. Теберда, ул. Берёзовая, д. 15Д;http://sanatoriy-ozon.ru/;+7 (918) 770-00-09;;ozon_a@mail.ru;Байрамкулов Бииаслан Алиевич;общество с ограниченной ответственностью;https://sanatoria.ru/san.php?org=268
269;Санаторий-профилакторий «Коммунальник»;Омская область;;644511, Омская область, Омский район, с. Красноярка;http://san-kommunalnik.ru/;+7 (3812) 470-560, 21-68-06;97-13-99;kommunalnik@inbox.ru;Михайлов Сергей Евгеньевич;открытое акционерное общество;https://sanatoria.ru/san.php?org=269
270;Детский санаторий им.;Ставропольский край;Железноводск;357400, Ставропольский край, г. Железноводск, ул. Семашко, д. 6.;http://www.krupsk.ru/;+7 (87932) 4-25-16, 4-17-56;4-25-16;krypsk@bechtau.ru;Ходова Тамара Викторовна;государственное учреждение;https://sanatoria.ru/san.php?org=270
271;Санаторий «Пятигорье»;Ставропольский край;Пятигорск;357500, Ставропольский край, г. Пятигорск, бульвар Гагарина, д. 1;http://fivemount.ru/;+7 (8793) 30-14-04, 97-38-04, +7 (800) 200-73-17;97-38-04;mail@fivemount.ru;Соц Александр Александрович;ОАО;https://sanatoria.ru/san.php?org=271
272;Санаторий «Марфинский»;городской округ Мытищи;;141052, Московская область, городской округ Мытищи, с. Марфино, ул. Санаторная;http://skkpodmoskovie.ru/sanatoriums/marfino/sanatorii_marfino/;+7 (495) 255-32-22 доб.1, 125-00-55;577-84-83;skk_pm_2@mil.ru;;филиал федерального государственного бюджетного учреждения;https://sanatoria.ru/san.php?org=272
273;Центр реабилитации ФСС РФ «Волгоград»;Волгоградская область;Волгоград;400079, Волгоградская область, г. Волгоград, ул. Санаторная, д. 29;http://volgosan.ru/;+7 (8442) 42-21-51, 42-17-38, 42-41-39, 42-39-60;49-01-50;polyana@volgosan.ru;Давыдов Илья Николаевич;федеральное бюджетное учреждение;https://sanatoria.ru/san.php?org=273
274;Санаторий «Долина Нарзанов»;;Нальчик;360002, КБР, г. Нальчик, ул. Марко Вовчок, 4;http://rzdz-dnn.ru/;+7 (8662) 720-353, 720-096, +7(800)555-2-777;720-539;info.dnn@rzdz.ru;;"филиал АО ""РЖД-ЗДОРОВЬЕ""";https://sanatoria.ru/san.php?org=274
275;Санаторий «Серебряный плёс»;Костромская область;;156539, Костромская область, Костромской район, д. Кузьминка, Санатория «Серебряный плес» территория, здание № 1;http://xn--90ahabtmmrecgk9j6b.xn--p1ai/;+7 (4942) 500-000, 494-539;;s.ples@mail.ru;Захарова Татьяна Львовна;общество с ограниченной ответственностью;https://sanatoria.ru/san.php?org=275
276;Санаторий «Жемчужина Дона»;Воронежская область;;396451, Воронежская область, муниципальный район Павловский, сельское поселение Казинское, территория Жемчужина Дона;http://san-zhemchdona.e-gov36.ru/;+7 (473) 624-11-84, +7(473) 624-11-75, +7(473) 624-11-92;;don.don.2014@yandex.ru;Резюкова Ирина Олеговна;;https://sanatoria.ru/san.php?org=276
277;Санаторий-профилакторий «Жемчужина»;Пензенская область;Пенза;440014, Пензенская область, г. Пенза, ул. Коннозаводская, д. 44 а;;;;;;;https://sanatoria.ru/san.php?org=277
278;Санаторий «Октябрьский»;Краснодарский край;Сочи;354053, Краснодарский край, г. Сочи, улица Плеханова, 34Б;http://oktyabrsky.ru/;+7 (862) 2-502-601;2-502-601;booking_oct@rzdz.ru;Заславская Ольга Юрьевна;акционерное общество;https://sanatoria.ru/san.php?org=278
280;Санаторий «Радон»;Воронежская область;Лиски;397909, Воронежская область, г. Лиски, ул. Коминтерна, д. 61;http://radon.rzdz.ru/?roistat_visit=1081724;+7 (47391) 4-01-88, 4-10-86;4-01-88;info.radon@rzdz.ru;;обособленное подразделение;https://sanatoria.ru/san.php?org=280
281;Санаторий «Целебный Нарзан»;Ставропольский край;Кисловодск;357700, Ставропольский край, г. Кисловодск, ул. Желябова, 5;http://cnarzan.ru/;+7 (87937) 9-54-00, 9-54-01, +7 (800) 100-44-74;;intournarzan@bk.ru;Дохов Анзор Магомедович;общество с ограниченной ответственностью;https://sanatoria.ru/san.php?org=281
282;Санаторий-профилакторий «Железнодорожник»;Ярославская область;Ярославль;150054, Ярославская область, г. Ярославль, ул. Павлика Морозова, д. 7;;+7 (4852) 79-99-66, 79-64-74, 79-29-45;;;Бритвенков Андрей Владимирович;;https://sanatoria.ru/san.php?org=282
283;Детский санаторий «Кедр»;Республика Коми;Сосногорск;169502, Республика Коми, г. Сосногорск, ул. Загородная, д. 3;http://vk.com/kedrdeti;+7 (82149) 55266, 56212;55266;;Маслова Надежда Денисовна;государственное бюджетное учреждение здравоохранения Республики Коми;https://sanatoria.ru/san.php?org=283
284;Санаторий «Россия» ГУ;Ставропольский край;Ессентуки;121099, Ставропольский край, г. Ессентуки, ул. Разумовского, д. 7;http://russia-sanatorii.ru/;+7 (87934) 6-22-11, 6-20-12, 6-21-45;6-20-12, 6-21-45;rossia_info@spa.ru;Копылов Эдуард Андреевич;филиал федерального государственного бюджетного учреждения;https://sanatoria.ru/san.php?org=284
285;Самарский областной детский санаторий «Юность»;;Самара;443031, г. Самара, Девятая просека, Третья линия, санаторий «Юность»;http://samunost.ru/;+7 (846) 952-94-81, +7 (846) 952-92-79;;06023@mail.miac.samregion.ru;Мокина Наталья Александровна;государственное бюджетное учреждение здравоохранения;https://sanatoria.ru/san.php?org=285
286;Санаторий «Жемчужина»;Приморский край;;692086, Приморский край, Кировский район, п. Горные ключи, ул. Профсоюзная, 1;;+7 (42354) 9-32-80, 2-47-85, 2-42-80;;;;ООО;https://sanatoria.ru/san.php?org=286
287;Санаторий-профилакторий «Яхонт»;;Трехгорный;456080, Челябинская обл., г. Трехгорный, ул. Космонавтов, 12-б;;+7 (35191) 6-21-38, +7 (35191) 6-21-16, +7 (35191) 6-21-39, +7 (35191) 4-23-77;;62138@mail.ru;Лилия Хамидрак;государственное учреждение;https://sanatoria.ru/san.php?org=287
288;Санаторий им. Воровского;Ярославская область;;152981, Ярославская область, Рыбинский район, п. Кстово, ул. Воровского, д. 15;http://san-vor.ru/;+7 (4855) 26-44-71, 26-63-26;26-42-09, 26-65-72;sanatory@list.ru;Кузнецова Наталия Юрьевна;закрытое акционерное общество;https://sanatoria.ru/san.php?org=288
289;Санаторий «Юган»;;Нефтеюганск;628300, Тюменская обл., Ханты-Мансийский окр., г. Нефтеюганск;http://ugan-86.ru/;+7 (3463) 23-89-82, 23-86-87, 23-88-35, 23-89-81;;guspugan@wsmail.ru;Чехута Виталий Иванович;;https://sanatoria.ru/san.php?org=289
290;Санаторий «Санус»;;;679132, ЕАО, Облученский район, посёлок Кульдур, ул. Большакова, д. 5;http://xn--80a0akcj.xn--p1ai/;+7 (42666) 34-2-73, 34-2-26, 34-3-57;34-2-73, 34-4-08;ya.sanus2014@yandex.ru;Тян Артур Васильевич;общество с ограниченной ответственностью;https://sanatoria.ru/san.php?org=290
291;Отель Оркестра Ока в Подмосковье;;;142942, Московская обл., Каширский район, п. Большое Руново;http://orchestra-oka.ru/;+7 (495) 150-37-32;;oka@orchestra-hotels.ru;Берова Марина Мухадиновна;общество с ограниченной ответственностью;https://sanatoria.ru/san.php?org=291
292;Санаторий-профилакторий «Жемчужина»;;Улан-Удэ;670002, г. Улан-Удэ, ул. Октябрьская, 2 Б;;+7 (3012) 44-02-66;;;Шадрина Татьяна Михайловна;;https://sanatoria.ru/san.php?org=292
293;Детский санаторий, реабилитационный центр «Детские Дюны»;Санкт-Петербург;;197701, Санкт-Петербург, Сестрорецк, 37-й км Приморского шоссе, дом 1;http://detdune.ru/;+7 (812) 437-40-04, 437-34-14;437-40-04;ddune@rambler.ru;Морозова Олеся Леонидовна;государственное бюджетное учреждение здравоохранения Санкт-Петербурга;https://sanatoria.ru/san.php?org=293
294;Кульдульский военный санаторий;;;679132, ЕАО, Облученский район, п. Кульдур, ул. Большакова, 15;http://skk-dv.ru/san-kuldursky/;+7 (42666) 34-2-06;;kuldursk@skk-dv.ru;;;https://sanatoria.ru/san.php?org=294
295;Санаторий-профилакторий «Кристалл»;Кемеровская область;Топки;652300, Кемеровская область, г. Топки, ул. Революции, д. 5;;+7 (38454) 4-81-83, +7 (38454) 4-81-85, +7 (923) 516-32-34;;;;;https://sanatoria.ru/san.php?org=295
296;Санаторий-профилакторий «Таежный»;Пермский край;Гремячинск;618270, Пермский край, г. Гремячинск, ул. Ленина, 272;;+7 (34250) 2-11-88, +7 (34250) 2-26-61, +7(904)848-15-11;;;;общество с ограниченной ответственностью;https://sanatoria.ru/san.php?org=296
297;Санаторий «Машук»;Ставропольский край;Пятигорск;357532, Ставропольский край, г. Пятигорск, Иноземцевское шоссе, д. 7;http://sanmashuk.ru/;+7 (8793) 32-95-99, 32-39-60, +7 800 500-77-91;32-39-60;info@sanmashuk.ru;Шамилева Анна Евгеньевна;частное лечебно-профилактическое учреждение;https://sanatoria.ru/san.php?org=297
298;Санаторий «Хоту» Якуткурорт;Республика Саха (Якутия);Якутск;677005, Республика Саха (Якутия), г. Якутск, ул. Петра Алексеева, 89;http://www.instagram.com/yk.kurort/;+7 (4112) 43-21-44, 43-23-01;;ykt.kurort@mail.ru;;АНО;https://sanatoria.ru/san.php?org=298
299;Санаторий «Самарский»;Самарская область;Самара;443031, Самарская область, г. Самара, Поляна им. Фрунзе, 9 просека, д. 4;http://samarskiy.ru/;+7 (846) 952-92-72, 221-13-13;952-92-72;sanatory@samarskiy.ru;Милевская Ирина Викторовна;общество с ограниченной ответственностью;https://sanatoria.ru/san.php?org=299
300;Санаторно-оздоровительный комплекс «Алые паруса»;;;445043, Самарская обл., Ставропольский р-он, около с. Ягодное;http://skb-welcome.ru/alyeparusa/;+7 (8482) 64-05-78, +7(848)264-74-86, +7(917)148-00-00;;sockultbit11@mail.ru;Артемьев Андрей Васильевич;общество с ограниченной ответственностью;https://sanatoria.ru/san.php?org=300
301;ГБУЗ Детский санаторий № 2, г. Челябинск;;;"454017, Россия, Челябинск, улица Мира, 34 (Педиатрическое отделение № 1); Россия, Челябинск, улица Первого Спутника, 13 (Педиатрическое отделение № 2)";http://xn--2-7sbaofscfde0bn0agdli.xn--p1ai/;+7 (351) 726-00-41, +7 (351) 721-14-11, +7 (351) 726-00-41;;ds2-174@yandex.ru;Гулидин Антон Валерьевич;государственное бюджетное учреждение здравоохранения;https://sanatoria.ru/san.php?org=301
302;Санаторий «Солнечный берег» Чувашия;Республика Чувашия;;429526, Республика Чувашия, Чебоксарский р-н, п. Сюктерка, ул. Солнечный берег, д. 1;http://sbereg.ru/;+7 (8352) 627-627, +7(8352)380-380, +7(8352)626-583;;dor-tour@cbx.ru;Николаев Олег Георгиевич;акционерное общество;https://sanatoria.ru/san.php?org=302
303;Санаторий «Джинал» Кисловодск;Ставропольский край;Кисловодск;357703, Ставропольский край, г. Кисловодск, ул. Пятигорская, д. 4;http://djinal.ru/;+7 (87937) 6-76-84, 6-76-81, +7 (800) 500-67-75;6-75-25;info@djinal.ru;Хомутов Сергей Михайлович;открытое акционерное общество;https://sanatoria.ru/san.php?org=303
304;Санаторий «Южное Взморье», Сочи;Краснодарский край;Сочи;354340, Краснодарский край, г. Сочи, Адлер, ул. Калинина, д. 1;http://uvzmorie.ru/;+7 (862) 269-15-50, 269-17-00, 269-19-00;240-09-73;vzmorie@sochi.com;Фогельзанг Иван Иванович;открытое акционерное общество;https://sanatoria.ru/san.php?org=304
305;Краевой геронтологический центр «Тонус»;Красноярский край;Назарово;662200, Красноярский край, г. Назарово, ул. Карла Маркса, д. 33;http://ctonus.ru/;+7 (39155) 7-00-56, +7(962)076-93-25, +7(960)753-15-60;;ton-21@yandex.ru;Черкашин Сергей Михайлович;краевое государственное автономное учреждение социального обслуживания;https://sanatoria.ru/san.php?org=305
306;Военный санаторий «Молоковка»;Забайкальский край;Чита;672026, Забайкальский край, г. Чита, ул. Молоковский тракт, 124;http://skk-dv.ru/san-molokovskiy/;+7 (3022) 310-046, +7(914)469-35-50;;skk.chita@yandex.ru;;;https://sanatoria.ru/san.php?org=306
307;Санаторий «Мокша», Мордовия;Республика Мордовия;Ковылкино;431351, Республика Мордовия, г. Ковылкино, ул. Заповедная;http://moksha.ru/;+7 (83453) 2-20-95, 2-56-74;2-20-95;aomoksha@moris.ru;Лазарев Виталий Петрович;открытое лечебно-оздоровительное акционерное общество;https://sanatoria.ru/san.php?org=307
